{
 "part": "01",
 "round": 3,
 "critic": "C1",
 "lens": "fidelity",
 "model": "claude-opus-5-5",
 "packet_sha": "8d95162dad2f8cba3697c136ad1fce25e1a26a9f43875220ea783f53d723d138",
 "questions": [
  {"id": "Q2", "score": 6, "note": "The cascade matches the scan and the declaration: the hallux just leads toe 2, toes 3 to 5 step back, and toe 5 is small and rolled with its nail off the top. The toes' own shapes depart from the scan and the photos. Toes 2-4 are slim straight cylinders with ring knuckles, the plantar toes are ring-banded stacks, the V3 tips are crimped, and the hallux is split from toe 2 by a slit."},
  {"id": "Q7", "score": 7, "note": "The ankle is the scan's. The lateral malleolus is lower and further back, a knob over its pocket (V3, V8), and the Achilles cord has hollows on both sides. The medial malleolus is soft, as on the scan, but reads a little blurrier than the scan's in V2, where the declared vein crosses it. No anterior ankle crease reads in V1f or V3."}
 ],
 "overall": 6,
 "defects": [
  {"id": "D1", "severity": "major", "preset": "pair_p01.V5f.L_form.png", "box_px": [1480, 0, 1950, 320], "what": "The dorsum carries five or more thin, crisp, evenly spaced extensor cords that run onto the toes. They are the sharpest relief on the foot. Here the scan's dorsum is a smooth dome with only broad, soft swells. The same cords show in V1f, V3 and the plan.", "fix": "A real extensor tendon at rest is a broad low ridge, about 4-6 mm wide and under 1 mm proud, that fades into the dorsum before the toes. On a lean foot only the EHL reads clearly.", "spec_ref": "§3.2"},
  {"id": "D2", "severity": "major", "preset": "pair_p01.V5f.L_form.png", "box_px": [1495, 290, 1905, 610], "what": "Toes 2-4 are slim, straight, parallel cylinders with rounded caps and ring knuckles. The scan's toes and the anchor photos' toes are plumper, with the pulp bulging past the nail, broad knuckles, and the toes pressed together. From above (plan) the render's toes read as fingers.", "fix": "Keep the scan's toe volumes. Widen each toe toward its pulp, let the pulp bulge below and ahead of the nail, and close the clefts so neighbours touch along their length.", "spec_ref": "§3.3"},
  {"id": "D3", "severity": "major", "preset": "pair_hr.plan_form.png", "box_px": [1530, 80, 1562, 215], "what": "From above, background shows between the hallux and toe 2 for about 40 mm back from the tips, and the V4o silhouette shows the same slit. So they do not touch, where the declaration and the scan have them pressed together.", "fix": "Lay the hallux's lateral side against toe 2 from the web to the tip, as on a boot-wearer's foot. The only dark should be a shallow contact groove.", "spec_ref": "§3.3"},
  {"id": "D4", "severity": "major", "preset": "pair_p01.V4.L_form.png", "box_px": [1350, 630, 1530, 810], "what": "From below, toes 2-5 are narrow stacks of ring-banded segments. The scan's plantar toes are plump round pads that nearly fill the space between them.", "fix": "Make each plantar toe one full pulp pad, separated from the next by a soft groove and from the ball by the sulcus, with at most one soft flexion crease.", "spec_ref": "§3.3"},
  {"id": "D5", "severity": "major", "preset": "pair_p01.V3.L_form.png", "box_px": [1095, 585, 1245, 665], "what": "From the lateral side the lesser toe tips are thin, crimped, sharp-edged overlapping lips. The scan's are round, full bulbs. The lateral toes that peek past the heel in V8 show the same crimped folds.", "fix": "Round the tips into full bulbs as on the scan, with no crisp edges where one toe overlaps the next."},
  {"id": "D6", "severity": "minor", "preset": "pair_p01.V3.L_form.png", "box_px": [1285, 610, 1312, 672], "what": "A crisp ring-line circles the 5th toe at its base, so the toe reads like a tube plugged into the forefoot. The scan's toe 5 flows into the lateral ball without a step.", "fix": "Blend the toe into the forefoot. A real basal crease is a short soft fold on the plantar side, not a ring around the toe."},
  {"id": "D7", "severity": "minor", "preset": "pair_p01.V5f.L_form.png", "box_px": [1485, 290, 1885, 345], "what": "Small sharp hook-like notches sit at the root of each web (hallux-2, 2-3, 3-4, 4-5), cut into the dorsal skin where the clefts end.", "fix": "End each web in a smooth rounded fold of skin, as on a real foot."},
  {"id": "D8", "severity": "minor", "preset": "pair_p01.V2o.L_form.png", "box_px": [1095, 300, 1130, 365], "what": "At about z 110 the posterior silhouette has a small kink, where the scan's shape hands over to the model's leg. The scan's back of the ankle runs in one smooth line there.", "fix": "Spread the blend from the scan to the leg over the whole 95-200 band so that the Achilles' back line has no step."}
 ],
 "ranked": [
  "[D1] The dorsum reads engraved, not domed: thin, crisp, evenly spaced tendon cords fan to every toe and are the sharpest relief on the foot. The scan's dorsum and the photos' dorsa show broad, soft swells.",
  "The declared veins stand so proud and cable-like that they cut the large forms: the transverse arch across the dorsum in V1f, and the saphenous vein over the instep and medial ankle in V2. They hide the instep's and the medial malleolus' shapes.",
  "[D2] Toes 2-4 are slim, straight, parallel cylinders with ring knuckles, which reads as fingers in V5f and in the plan. A man's toes, on the scan and in the photos, are plumper, pulp-heavy and pressed together.",
  "[D4] From below, the lesser toes are ring-banded stacks of segments instead of the scan's full round pulp pads.",
  "[D3] The hallux does not touch toe 2: background shows between them for about 40 mm back from the tips in the plan and in the V4o silhouette, against the declaration and the scan.",
  "[D5] The lesser toe tips are crimped and sharp-edged in V3, and the toes that peek past the heel in V8 are crimped the same way. The scan's are round bulbs.",
  "The toe row is too tidy: five neat rounded caps, each with a small nail on its tip, step down evenly. The scan's toe row is irregular and lumpy, as real toes are.",
  "Sharpness is uneven: the scan-derived heel, sole and ankle are soft and organic, while the dorsum, toes and webs are crisp. The foot reads as two surfaces by different hands.",
  "[D6] The 5th toe has a crisp ring at its base in V3, as if it were a separate tube plugged into the forefoot.",
  "In V2 the medial malleolus and the hollows around it read a little blurrier than on the scan, which already has a weak dome. The vein over it adds to that.",
  "No anterior ankle crease reads at the front of the ankle in V1f or V3. The fold at the dorsiflexion line is missing at these views.",
  "[D7] Small sharp hook notches sit at the roots of the webs in V5f.",
  "[D8] At about z 110 the posterior outline in V2o has a small kink, where the scan's ankle hands over to the model's leg.",
  "In V4o and V4 a medial bulge from the leg above (declared, spec 03's) overlaps the heel's medial outline, so the plantar views cannot judge that edge."
 ],
 "verified_claims": [
  {"id": "r2.m1", "fixed": true},
  {"id": "r2.m2", "fixed": true},
  {"id": "r2.m3", "fixed": false},
  {"id": "r2.m4", "fixed": true},
  {"id": "r2.m5", "fixed": true},
  {"id": "r2.m6", "fixed": true},
  {"id": "r2.m7", "fixed": true},
  {"id": "r2.m8", "fixed": true},
  {"id": "r2.m9", "fixed": false},
  {"id": "r2.m10", "fixed": true},
  {"id": "r2.m11", "fixed": true},
  {"id": "r2.m12", "fixed": false},
  {"id": "r2.m13", "fixed": true},
  {"id": "r2.m14", "fixed": true},
  {"id": "r2.m15", "fixed": true},
  {"id": "r2.m16", "fixed": true},
  {"id": "r2.m17", "fixed": false},
  {"id": "r2.m18", "fixed": true},
  {"id": "r2.m19", "fixed": true},
  {"id": "r2.m20", "fixed": true},
  {"id": "r2.m21", "fixed": true},
  {"id": "r2.m22", "fixed": false},
  {"id": "r2.m23", "fixed": false},
  {"id": "r2.m24", "fixed": true},
  {"id": "r2.m25", "fixed": true},
  {"id": "r2.m26", "fixed": true},
  {"id": "r2.m27", "fixed": false},
  {"id": "r2.m28", "fixed": true},
  {"id": "r2.m29", "fixed": false},
  {"id": "r2.m30", "fixed": true},
  {"id": "r2.m31", "fixed": true}
 ],
 "pass": false,
 "confidence": 0.65
}
