{
 "part": "01",
 "round": 3,
 "critic": "C3",
 "lens": "craft",
 "model": "claude-opus-5-5",
 "packet_sha": "8d95162dad2f8cba3697c136ad1fce25e1a26a9f43875220ea783f53d723d138",
 "questions": [
  {"id": "Q2", "score": 5, "note": "The cascade is right: the hallux leads, toe 2 is close behind, 3 to 5 step back and the 5th lies small against the 4th. The modelling gives it away, though. The lesser toes are straight, parallel cylinders with ring-band knuckles and dark clefts down to the webs (plan, V5f). From below they are stacked pills (V4), and a slit separates the hallux from toe 2 (V4o). Little pulp bulge."},
  {"id": "Q7", "score": 6, "note": "The scan's ankle reads real. The lateral malleolus sits lower and further back with its hollow, and the Achilles is a clear cord with hollows either side in V8. The medial malleolus is only a faint swell in V2 and V8. In V8 a broad extra column fills the medial side and spoils the read. No anterior ankle crease shows in V1f, V2 or V3."}
 ],
 "overall": 6,
 "defects": [
  {"id": "D1", "severity": "major", "preset": "pair_hr.plan_form.png", "box_px": [1320, 70, 1650, 320], "what": "From above the toes are separate cylindrical shafts with ring-band knuckles and dark clefts nearly to the webs. A dark slot runs along the base between the hallux and toe 2, so the row reads as a hand's fingers, where the scan's toes press together.", "fix": "Close the clefts so the lesser toes touch side by side and broaden their bases. Soften the knuckle rings into low dorsal swells and lay the hallux against toe 2 with no slot.", "spec_ref": "§3.3"},
  {"id": "D2", "severity": "major", "preset": "pair_p01.V4.L_form.png", "box_px": [1350, 630, 1595, 810], "what": "From below, toes 2 to 4 are parallel cylinders cut by crisp transverse ring creases, like stacked pills, and the 5th is a crumpled knot. The scan beside it shows plump rounded pads behind a soft sulcus.", "fix": "Give each plantar toe one domed pulp pad and a soft flexion crease or two. Let the pads widen and touch, sitting behind a continuous toe sulcus as in the scan.", "spec_ref": "§3.3"},
  {"id": "D3", "severity": "major", "preset": "pair_p01.V8.L_form.png", "box_px": [1665, 0, 1975, 720], "what": "From behind, a broad second mass fills the frame beyond the heel's medial edge, far outside the scan's ankle outline. The heel then sits under the lateral half of the column and the medial malleolus is lost against it.", "fix": "Make the medial side of the ankle end where the scan's does, a malleolus-width outside the heel, or hide whatever other geometry stands there in this view.", "spec_ref": "§3.1"},
  {"id": "D4", "severity": "major", "preset": "pair_p01.V4o.L_form.png", "box_px": [1512, 795, 1540, 918], "what": "The plantar silhouette has a narrow, deep slit between the hallux and toe 2 that runs up to the web and ends in a pinched spike. The two toes should touch; they should not stand apart along their length.", "fix": "Close the gap so the hallux and toe 2 meet along their sides, with only a shallow groove at the web.", "spec_ref": "§3.3"},
  {"id": "D5", "severity": "major", "preset": "pair_p01.V1f.L_form.png", "box_px": [1290, 470, 1650, 730], "what": "The extensor tendons are five or six thin, crisp, evenly spaced ridges from the ankle to the toes. They are the sharpest relief on the foot, so the scan's soft dorsal dome reads engraved with cables.", "fix": "Real extensor cords on a relaxed foot are low, broad and blurred into the dome. Only the hallux's shows clearly. Lower and widen the rest and fade them out over the metatarsals.", "spec_ref": "§3.2"},
  {"id": "D6", "severity": "major", "preset": "pair_p01.V3.L_form.png", "box_px": [1090, 585, 1310, 665], "what": "From the side, the 5th toe ends at its base in a hard vertical ring, like a capped tube. The tips of the other toes carry crimped rims and creases, where the scan's toes are smooth rounded beads.", "fix": "Blend the 5th toe's base into the forefoot with a soft fold. Round the tips into pulp bulges under the nails, with no sharp rims."},
  {"id": "D7", "severity": "major", "preset": "pair_p01.V2o.L_form.png", "box_px": [1092, 305, 1122, 370], "what": "The back of the ankle's silhouette steps in with a small kink about 110 mm up, in the zone where the scan's shape eases into the model's own leg. Two shapes meet there instead of one smooth Achilles curve.", "fix": "Ease the blend over a longer band so the posterior outline keeps continuous curvature from the heel up into the leg.", "spec_ref": "§3.2"},
  {"id": "D8", "severity": "minor", "preset": "pair_p01.V4.L_form.png", "box_px": [1530, 738, 1580, 762], "what": "A short, straight, sharp slit crosses the hallux's plantar pad and reads as a knife cut, not a skin crease.", "fix": "A real interphalangeal crease is a shallow, slightly curved fold with soft lips; make it wider and less deep."},
  {"id": "D9", "severity": "minor", "preset": "pair_p01.V5f.L_form.png", "box_px": [1630, 280, 1890, 335], "what": "Small sharp slits and ticks sit at the roots of the 2-3, 3-4 and 4-5 webs. They read as mesh pinches, not soft skin folds.", "fix": "Round the web roots into shallow U-shaped commissures with no hard edge."},
  {"id": "D10", "severity": "minor", "preset": "pair_p01.V5f.L_form.png", "box_px": [1300, 380, 1420, 450], "what": "Concentric, contour-like ripples cover the back of the hallux behind the nail fold, like a displacement artefact. A real joint has two or three transverse interphalangeal wrinkles instead.", "fix": "Replace the rings with a few transverse wrinkles over the joint, of uneven length and depth."},
  {"id": "D11", "severity": "minor", "preset": "pair_p01.V8.L_form.png", "box_px": [1235, 595, 1310, 695], "what": "The lateral toes that show past the heel from behind carry crinkled, crimped ridges like crumpled plastic. The scan's toes in the same place are smooth beads."}
 ],
 "ranked": [
  "[D1] From above the toes are a hand's fingers: separate shafts with bead knuckles and dark clefts to the webs, with a slot along the hallux. A man's toes press together, broadest at the bases, as in the scan beside them.",
  "[D2] From below, the toes are stacked pills with crisp ring creases. Real plantar toes are one plump pad each, behind a soft sulcus.",
  "Two methods show: the scanned body is soft and organic, but the modelled toes and dorsal relief are crisp, regular and hard-edged. Detail is sharp in those places and soft everywhere else, so the foot reads stitched together.",
  "[D3] From behind, a broad mass stands outside the heel's medial edge, beyond the scan's outline. The ankle reads off-centre over the heel and the medial malleolus disappears into it.",
  "[D5] The dorsum carries thin, even, crisp tendon cords that read as cables on a smooth dome. A relaxed foot shows one clear hallux tendon and soft, blurred ridges for the others.",
  "The declared vein relief hides the dorsum's large form. In V1f the venous arch crosses the instep as one hard line like a strap seam, and in V2o it nicks the instep silhouette.",
  "[D4] In the plantar silhouette, a narrow slit with a spike at its top separates the hallux from toe 2. The declaration has them touching.",
  "[D6] From the side, the 5th toe ends in a hard ring like a capped tube, and the other tips are crimped. The scan's toes are smooth rounded beads there.",
  "The lesser toes in V5f are straight, parallel and flat-topped, with the nail on the very tip. Real lesser toes are short, flex down at the joints and have a pulp that bulges past the nail.",
  "[D7] The posterior ankle outline kinks about 110 mm up, where the scan eases into the model's leg: a step where two shapes meet.",
  "No anterior ankle crease reads at the front of the ankle in V1f, V2 or V3. A real foot shows a soft fold there at the dorsiflexion line.",
  "The medial malleolus is only a faint swell in V2 and V8, while the lateral one is a clear knob, so the ankle reads one-sided. This is as in the scan, but a lean man's medial dome usually shows.",
  "Above about 150 mm the leg in V2 and V3 is a perfectly straight, smooth tube. The scanned ankle looks grafted onto a mannequin shin.",
  "[D8] A straight, sharp slit across the hallux's plantar pad reads as a cut, not a crease.",
  "[D9] Sharp slits sit at the roots of the lesser toes' webs, like mesh pinches.",
  "[D10] Contour-like ripple rings sit on the back of the hallux, a displacement artefact rather than interphalangeal wrinkles.",
  "[D11] The lateral toes that show behind the heel in V8 are crinkled like crumpled plastic."
 ],
 "verified_claims": [
  {"id": "r2.m1", "fixed": true},
  {"id": "r2.m2", "fixed": true},
  {"id": "r2.m3", "fixed": false},
  {"id": "r2.m4", "fixed": true},
  {"id": "r2.m5", "fixed": true},
  {"id": "r2.m6", "fixed": true},
  {"id": "r2.m7", "fixed": true},
  {"id": "r2.m8", "fixed": false},
  {"id": "r2.m9", "fixed": false},
  {"id": "r2.m10", "fixed": true},
  {"id": "r2.m11", "fixed": true},
  {"id": "r2.m12", "fixed": false},
  {"id": "r2.m13", "fixed": false},
  {"id": "r2.m14", "fixed": true},
  {"id": "r2.m15", "fixed": true},
  {"id": "r2.m16", "fixed": false},
  {"id": "r2.m17", "fixed": false},
  {"id": "r2.m18", "fixed": false},
  {"id": "r2.m19", "fixed": true},
  {"id": "r2.m20", "fixed": false},
  {"id": "r2.m21", "fixed": false},
  {"id": "r2.m22", "fixed": false},
  {"id": "r2.m23", "fixed": false},
  {"id": "r2.m24", "fixed": true},
  {"id": "r2.m25", "fixed": true},
  {"id": "r2.m26", "fixed": true},
  {"id": "r2.m27", "fixed": false},
  {"id": "r2.m28", "fixed": true},
  {"id": "r2.m29", "fixed": true},
  {"id": "r2.m30", "fixed": false},
  {"id": "r2.m31", "fixed": true}
 ],
 "pass": false,
 "confidence": 0.6
}
