{
 "part": "01",
 "round": 4,
 "critic": "C1",
 "lens": "fidelity",
 "model": "claude-opus-5-5",
 "packet_sha": "8ae8439c2db96d6174877722934c895261648ea233638df984c8e1a6aa7d91c9",
 "questions": [
  {"id": "Q2", "score": 6, "note": "Order and cascade follow the scan: the hallux just ahead of toe 2 and touching it, toes 3-5 stepping back, toe 5 rolled outward. Individual shaping is weak. Toes 2-4 are near-identical straight columns with no knuckle hump. The lateral tips are crimped in V3, the plantar pads look like stacked pills, toe 5 has a ring at its base, and the lesser toes are slimmer than the scan's."},
  {"id": "Q7", "score": 7, "note": "Heel, malleoli and Achilles follow the scan closely. From behind, the medial bulge sits higher and in lower relief; the lateral sits lower, more prominent and further back (V2/V3). The Achilles is a broad cord with hollows on both sides, and the column now sits over the heel. No anterior ankle crease shows in clay at the front of the ankle in V2, V3 or V1f."}
 ],
 "overall": 7,
 "defects": [
  {"id": "D1", "severity": "major", "preset": "pair_p01.V5f.L_form.png", "box_px": [1495, 280, 1905, 605], "what": "Toes 2-4 are three near-identical, straight, parallel columns with level tops and no PIP knuckle hump; the scan's toes each swell at the knuckle and flare into a round pulp, and no two are alike.", "fix": "Give each lesser toe its own dorsal PIP hump behind the nail fold, a slight downward curl to the tip and its own width and taper, following the scan's bulbs.", "spec_ref": "§3.3"},
  {"id": "D2", "severity": "major", "preset": "pair_p01.V3.L_form.png", "box_px": [1095, 580, 1245, 668], "what": "In the lateral view the lesser toe tips are thin and crimped, with sharp top edges, lower and flatter than the scan's round, full bulbs at the same place.", "fix": "Keep the scan's toe volume there: round full pulps with soft outlines, the tips as thick as the scan's.", "spec_ref": "§3.3"},
  {"id": "D3", "severity": "minor", "preset": "pair_p01.V3.L_form.png", "box_px": [1225, 605, 1312, 670], "what": "Toe 5 meets the forefoot through a crisp vertical ring near its base, like a tube plugged into a sleeve; the scan's toe 5 runs into the forefoot with no edge.", "fix": "Blend the toe's base into the forefoot over several millimetres, with no ring or step.", "spec_ref": "§3.3"},
  {"id": "D4", "severity": "major", "preset": "pair_p01.V4.L_form.png", "box_px": [1350, 630, 1530, 810], "what": "From below, toes 2-5 are stacked pills with crisp transverse ring creases and hard outlines; the scan's plantar toes are each one plump pad behind a soft sulcus.", "fix": "One full plantar pad per toe, a soft sulcus at the base, and at most faint flexion creases.", "spec_ref": "§3.3"},
  {"id": "D5", "severity": "minor", "preset": "pair_p01.V5f.L_form.png", "box_px": [1485, 285, 1905, 350], "what": "Small, sharp, hook-shaped notches sit at the roots of the webs between toes 2-3, 3-4 and 4-5, also visible in V1f.", "fix": "The web roots are soft, shallow U-shaped saddles of skin.", "spec_ref": "§3.2"},
  {"id": "D6", "severity": "minor", "preset": "pair_p01.V4.L_form.png", "box_px": [1530, 735, 1580, 765], "what": "A short, sharp mark across the hallux's plantar pad reads as a cut, not a soft flexion crease.", "fix": "A shallow, soft-edged IP crease, or none at this scale.", "spec_ref": "§3.3"},
  {"id": "D7", "severity": "minor", "preset": "pair_p01.V5f.L_form.png", "box_px": [1270, 380, 1420, 450], "what": "Fine contour-like ripple rings on the back of the hallux (and around its tip in hr.plan) are a displacement artefact, not skin wrinkles.", "fix": "Smooth skin, or a few irregular transverse wrinkles over the IP joint only.", "spec_ref": "§3.3"},
  {"id": "D8", "severity": "minor", "preset": "pair_hr.plan_form.png", "box_px": [1320, 150, 1480, 320], "what": "From above, crisp crinkle lines and dark slits at the bases of toes 3, 4 and 5 make the lesser toes read as separate fingers; the scan's toes merge into the forefoot through soft webs.", "fix": "Soft webs that close between the toes' bases, as the scan's do.", "spec_ref": "§3.3"},
  {"id": "D9", "severity": "minor", "preset": "pair_p01.V4o.L_form.png", "box_px": [1518, 788, 1540, 815], "what": "A small speck of background still shows between the hallux and toe 2 in the plantar silhouette: a pinhole where the two should touch.", "fix": "Close the contact so the silhouette is solid between hallux and toe 2.", "spec_ref": "§3.3"},
  {"id": "D10", "severity": "minor", "preset": "pair_p01.V8.L_form.png", "box_px": [1235, 595, 1335, 705], "what": "The lateral toes that peek past the heel are crinkled with sharp ridges, crisper than the scan's soft rings at the same place.", "fix": "The same round, soft toe bulbs as the scan's.", "spec_ref": "§3.3"},
  {"id": "D11", "severity": "major", "preset": "pair_p01.V1f.L_form.png", "box_px": [1250, 640, 1590, 780], "what": "In the proportion view the lesser toes are slimmer and more separate than the scan's fat, pressed-together bulbs, with a crisp notch at each web root, so the forefoot reads more delicate than the scan's.", "fix": "Keep the scan's toe girth and the toes pressed together; only the nails and fine relief should be new.", "spec_ref": "§3.3"}
 ],
 "ranked": [
  "[D11] In V1f, the view for proportion, the lesser toes are slimmer, more separate and more delicate than the scan's thick, pressed-together toes. The forefoot reads younger and finer than a boot-wearing man's.",
  "[D1] Toes 2-4 are near-identical straight columns with no knuckle humps. Real toes (scan and photographs) each bulge at the PIP joint, curl slightly and differ in width and taper.",
  "[D2] In the lateral view the lesser toe tips are thin, flat and crimped with hard edges, where the scan has round, full pulps.",
  "[D4] From below the toes are stacked pills with crisp ring creases; real plantar toes are one plump pad each behind a soft sulcus.",
  "The toes are crisp and hard-edged while the rest of the foot is soft scan surface. They read as a separate sculpt grafted onto the scan, not one continuous skin.",
  "[D3] Toe 5 has a crisp ring at its base in V3, like a tube in a sleeve; the scan's runs into the forefoot without an edge.",
  "[D8] From above, crisp crinkles and dark slits at the bases of toes 3-5 make the lesser toes read as fingers rather than toes pressed together.",
  "[D5] Sharp hook notches at the web roots (V5f, V1f) where real webs are soft saddles.",
  "[D7] Contour-ripple rings on the back and tip of the hallux read as a displacement artefact.",
  "[D6] A sharp slit-like mark across the hallux's plantar pad reads as a cut.",
  "[D10] The lateral toes seen past the heel in V8 are crinkled and sharper than the scan's at the same place.",
  "[D9] A pinhole of background between hallux and toe 2 in the V4o silhouette, where they should touch.",
  "No anterior ankle crease shows at the front of the ankle in V2 or V3. The hard transverse line across the mid-instep in V1f (the venous arch, out of scope) reads as a fold and breaks the dome of the dorsum.",
  "Context: from below (V4, V4o) spec 03's calf stands well past the foot's medial border near the heel and hides the medial heel and arch outline, so the plantar silhouette cannot be compared there."
 ],
 "verified_claims": [
  {"id": "r3.m1", "fixed": false},
  {"id": "r3.m2", "fixed": true},
  {"id": "r3.m3", "fixed": false},
  {"id": "r3.m4", "fixed": true},
  {"id": "r3.m5", "fixed": true},
  {"id": "r3.m6", "fixed": false},
  {"id": "r3.m7", "fixed": true},
  {"id": "r3.m8", "fixed": true},
  {"id": "r3.m9", "fixed": false},
  {"id": "r3.m10", "fixed": true},
  {"id": "r3.m11", "fixed": true},
  {"id": "r3.m12", "fixed": true},
  {"id": "r3.m13", "fixed": false},
  {"id": "r3.m14", "fixed": false},
  {"id": "r3.m15", "fixed": false},
  {"id": "r3.m16", "fixed": false},
  {"id": "r3.m17", "fixed": false},
  {"id": "r3.m18", "fixed": false}
 ],
 "pass": false,
 "confidence": 0.65
}
